{
  "documents": [
    {
      "annotation_revision": "agent-seed-corpus-expansion-9@2026-08-12",
      "annotation_sha256": "897f56556a7bab5958497eb8e8baf7c7a7df29eec9554ab62116a1d4d2535a4e",
      "cases": [
        {
          "bbox_norm": [
            0.57,
            0.53,
            0.94,
            0.83
          ],
          "case_id": "microchip-mcp73831-ds20001984h-2020/pinout-positive",
          "crop_sha256": "00a93c00b7972fda3708847e01bd98dda1a1ce2da11e1a41c5429c17335d08d0",
          "label": "positive",
          "page": 1,
          "region_type": "pinout",
          "view": "top"
        },
        {
          "bbox_norm": [
            0.07,
            0.08,
            0.94,
            0.42
          ],
          "case_id": "microchip-mcp73831-ds20001984h-2020/table-positive",
          "crop_sha256": "beb0f2ebf0776a4907b2109030c2cb3e8c10dbbb9a978d7c6b69db7a7476a4d3",
          "label": "positive",
          "page": 11,
          "region_type": "table",
          "view": "not_applicable"
        },
        {
          "bbox_norm": [
            0.07,
            0.08,
            0.94,
            0.91
          ],
          "case_id": "microchip-mcp73831-ds20001984h-2020/package-positive",
          "crop_sha256": "ca6ed8d187d6069e68e4d1de54b38c93860d1b03d8133d4e0fdfb6616cbd097b",
          "label": "positive",
          "page": 22,
          "region_type": "package",
          "view": "not_applicable"
        },
        {
          "bbox_norm": [
            0.07,
            0.08,
            0.94,
            0.91
          ],
          "case_id": "microchip-mcp73831-ds20001984h-2020/wrong-package",
          "crop_sha256": "ca6ed8d187d6069e68e4d1de54b38c93860d1b03d8133d4e0fdfb6616cbd097b",
          "label": "wrong_package",
          "page": 22,
          "region_type": "package",
          "view": "not_applicable"
        },
        {
          "bbox_norm": [
            0.07,
            0.08,
            0.94,
            0.91
          ],
          "case_id": "microchip-mcp73831-ds20001984h-2020/wrong-variant",
          "crop_sha256": "20945ed917cec0ab38f494ae6e6df8ce11139c45c4a6062ad83f9ef729e145a2",
          "label": "wrong_variant",
          "page": 26,
          "region_type": "package",
          "view": "not_applicable"
        },
        {
          "bbox_norm": [
            0.57,
            0.53,
            0.94,
            0.83
          ],
          "case_id": "microchip-mcp73831-ds20001984h-2020/wrong-view",
          "crop_sha256": "00a93c00b7972fda3708847e01bd98dda1a1ce2da11e1a41c5429c17335d08d0",
          "label": "wrong_view",
          "page": 1,
          "region_type": "pinout",
          "view": "bottom"
        },
        {
          "bbox_norm": [
            0.07,
            0.08,
            0.94,
            0.91
          ],
          "case_id": "microchip-mcp73831-ds20001984h-2020/wrong-figure-block-as-pinout",
          "crop_sha256": "b7365b68272bfa2a5353d3c4eb167ab0d56e0fcb170a5ed383527e493c5bd945",
          "label": "wrong_figure",
          "page": 2,
          "region_type": "pinout",
          "view": "not_applicable"
        }
      ],
      "id": "microchip-mcp73831-ds20001984h-2020",
      "source_sha256": "75297f2a5235599368381adfb63df2652cc22d757f171f388147b2ab3d32776f"
    },
    {
      "annotation_revision": "agent-seed-corpus-expansion-10@2026-08-12",
      "annotation_sha256": "e9a4c85158c224b4dfeff89b1ed5c6361736e8aadd6794be74071d7531b7b53c",
      "cases": [
        {
          "bbox_norm": [
            0.07,
            0.08,
            0.94,
            0.76
          ],
          "case_id": "wiznet-w5500-v1-1-0-2022-12/pinout-positive",
          "crop_sha256": "ccf3721d18650c8f2f40b6ca9136620ca887ab76ce5f890b8f7847a476492e22",
          "label": "positive",
          "page": 7,
          "region_type": "pinout",
          "view": "top"
        },
        {
          "bbox_norm": [
            0.07,
            0.08,
            0.94,
            0.91
          ],
          "case_id": "wiznet-w5500-v1-1-0-2022-12/table-positive",
          "crop_sha256": "7139b0bab45e30af730e9656bcbb556f13934968b79d0e7891c4d393c2fe1769",
          "label": "positive",
          "page": 8,
          "region_type": "table",
          "view": "not_applicable"
        },
        {
          "bbox_norm": [
            0.07,
            0.08,
            0.94,
            0.91
          ],
          "case_id": "wiznet-w5500-v1-1-0-2022-12/package-positive",
          "crop_sha256": "7d460b68e667f0ee42ef1990b70b98dd3e322c8e5037c1238423315d55263eb9",
          "label": "positive",
          "page": 64,
          "region_type": "package",
          "view": "not_applicable"
        },
        {
          "bbox_norm": [
            0.07,
            0.08,
            0.94,
            0.91
          ],
          "case_id": "wiznet-w5500-v1-1-0-2022-12/wrong-package",
          "crop_sha256": "7d460b68e667f0ee42ef1990b70b98dd3e322c8e5037c1238423315d55263eb9",
          "label": "wrong_package",
          "page": 64,
          "region_type": "package",
          "view": "not_applicable"
        },
        {
          "bbox_norm": [
            0.07,
            0.08,
            0.94,
            0.91
          ],
          "case_id": "wiznet-w5500-v1-1-0-2022-12/wrong-variant",
          "crop_sha256": "7d460b68e667f0ee42ef1990b70b98dd3e322c8e5037c1238423315d55263eb9",
          "label": "wrong_variant",
          "page": 64,
          "region_type": "package",
          "view": "not_applicable"
        },
        {
          "bbox_norm": [
            0.07,
            0.08,
            0.94,
            0.76
          ],
          "case_id": "wiznet-w5500-v1-1-0-2022-12/wrong-view",
          "crop_sha256": "ccf3721d18650c8f2f40b6ca9136620ca887ab76ce5f890b8f7847a476492e22",
          "label": "wrong_view",
          "page": 7,
          "region_type": "pinout",
          "view": "bottom"
        },
        {
          "bbox_norm": [
            0.07,
            0.08,
            0.94,
            0.91
          ],
          "case_id": "wiznet-w5500-v1-1-0-2022-12/wrong-figure-block-as-pinout",
          "crop_sha256": "560083a3ea5d595e613a46240703dcdf3ec7491c04112900ad2d392047bc74ef",
          "label": "wrong_figure",
          "page": 4,
          "region_type": "pinout",
          "view": "not_applicable"
        }
      ],
      "id": "wiznet-w5500-v1-1-0-2022-12",
      "source_sha256": "7b826b808084ccd986bcc22904c00a07a508ef42fb93d079fe7150a4c4f1a63d"
    }
  ],
  "packet_sha256": "ab32da9b3c2ea9aa9b2d0beca9c45f6b2840ea371d7d6a58e4085350d6795f8e",
  "registry_sha256": "e2e738b6d16eade34571549b062aa4ce80f25e945bb24085cbe42408c932675d",
  "schema_version": "dsvire.visual-review-packet.v2"
}
